URL,Text
https://en.wikipedia.org/wiki/Web_scraping,"Web scraping, web harvesting, or web data extraction is data scraping used for extracting data from websites.[1] Web scraping software may directly access the World Wide Web using the Hypertext Transfer Protocol or a web browser. While web scraping can be done manually by a software user, the term typically refers to automated processes implemented using a bot or web crawler. It is a form of copying in which specific data is gathered and copied from the web, typically into a central local database or spreadsheet, for later retrieval or analysis. Scraping a web page involves fetching it and then extracting data from it. Fetching is the downloading of a page (which a browser does when a user views a page). Therefore, web crawling is a main component of web scraping, to fetch pages for later processing. Having fetched, extraction can take place. The content of a page may be parsed, searched and reformatted, and its data copied into a spreadsheet or loaded into a database. Web scrapers typically take something out of a page, to make use of it for another purpose somewhere else. An example would be finding and copying names and telephone numbers, companies and their URLs, or e-mail addresses to a list (contact scraping). As well as contact scraping, web scraping is used as a component of applications used for web indexing, web mining and data mining, online price change monitoring and price comparison, product review scraping (to watch the competition), gathering real estate listings, weather data monitoring, website change detection, research, tracking online presence and reputation, web mashup, and web data integration. Web pages are built using text-based mark-up languages (HTML and XHTML), and frequently contain a wealth of useful data in text form. However, most web pages are designed for human end-users and not for ease of automated use. As a result, specialized tools and software have been developed to facilitate the scraping of web pages. Web scraping applications include market research, price comparison, content monitoring, and more.  Businesses rely on web scraping services to efficiently gather and utilize this data. Newer forms of web scraping involve monitoring data feeds from web servers.  For example, JSON is commonly used as a transport mechanism between the client and the web server. There are methods that some websites use to prevent web scraping, such as detecting and disallowing bots from crawling (viewing) their pages. In response, web scraping systems use techniques involving DOM parsing, computer vision and natural language processing to simulate human browsing to enable gathering web page content for offline parsing. After the birth of the World Wide Web in 1989, the first web robot,[2] World Wide Web Wanderer, was created in June 1993, which was intended only to measure the size of the web. In December 1993, the first crawler-based web search engine, JumpStation, was launched. As there were fewer websites available on the web, search engines at that time used to rely on human administrators to collect and format links. In comparison, Jump Station was the first WWW search engine to rely on a web robot. In 2000, the first Web API and API crawler were created. An API (Application Programming Interface) is an interface that makes it much easier to develop a program by providing the building blocks. In 2000, Salesforce and eBay launched their own API, with which programmers could access and download some of the data available to the public. Since then, many websites offer web APIs for people to access their public database. Web scraping is the process of automatically mining data or collecting information from the World Wide Web. It is a field with active developments sharing a common goal with the semantic web vision, an ambitious initiative that still requires breakthroughs in text processing, semantic understanding, artificial intelligence and human-computer interactions. The simplest form of web scraping is manually copying and pasting data from a web page into a text file or spreadsheet. Sometimes even the best web-scraping technology cannot replace a human's manual examination and copy-and-paste, and sometimes this may be the only workable solution when the websites for scraping explicitly set up barriers to prevent machine automation. A simple yet powerful approach to extract information from web pages can be based on the UNIX grep command or regular expression-matching facilities of programming languages (for instance Perl or Python). Static and dynamic web pages can be retrieved by posting HTTP requests to the remote web server using socket programming. Many websites have large collections of pages generated dynamically from an underlying structured source like a database. Data of the same category are typically encoded into similar pages by a common script or template. In data mining, a program that detects such templates in a particular information source, extracts its content, and translates it into a relational form, is called a wrapper. Wrapper generation algorithms assume that input pages of a wrapper induction system conform to a common template and that they can be easily identified in terms of a URL common scheme.[3] Moreover, some semi-structured data query languages, such as XQuery and the HTQL, can be used to parse HTML pages and to retrieve and transform page content. By embedding a full-fledged web browser, such as the Internet Explorer or the Mozilla browser control, programs can retrieve the dynamic content generated by client-side scripts. These browser controls also parse web pages into a DOM tree, based on which programs can retrieve parts of the pages. Languages such as Xpath can be used to parse the resulting DOM tree. There are several companies that have developed vertical specific harvesting platforms. These platforms create and monitor a multitude of ""bots"" for specific verticals with no ""man in the loop"" (no direct human involvement), and no work related to a specific target site. The preparation involves establishing the knowledge base for the entire vertical and then the platform creates the bots automatically. The platform's robustness is measured by the quality of the information it retrieves (usually number of fields) and its scalability (how quick it can scale up to hundreds or thousands of sites). This scalability is mostly used to target the Long Tail of sites that common aggregators find complicated or too labor-intensive to harvest content from. The pages being scraped may embrace metadata or semantic markups and annotations, which can be used to locate specific data snippets. If the annotations are embedded in the pages, as Microformat does, this technique can be viewed as a special case of DOM parsing. In another case, the annotations, organized into a semantic layer,[4] are stored and managed separately from the web pages, so the scrapers can retrieve data schema and instructions from this layer before scraping the pages. There are efforts using machine learning and computer vision that attempt to identify and extract information from web pages by interpreting pages visually as a human being might.[5] Uses advanced AI to interpret and process web page content contextually, extracting relevant information, transforming data, and customizing outputs based on the content's structure and meaning. This method enables more intelligent and flexible data extraction, accommodating complex and dynamic web content. The legality of web scraping varies across the world. In general, web scraping may be against the terms of service of some websites, but the enforceability of these terms is unclear.[6] In the United States, website owners can use three major legal claims to prevent undesired web scraping: (1) copyright infringement (compilation), (2) violation of the Computer Fraud and Abuse Act (""CFAA""), and (3) trespass to chattel.[7] However, the effectiveness of these claims relies upon meeting various criteria, and the case law is still evolving. For example, with regard to copyright, while outright duplication of original expression will in many cases be illegal, in the United States the courts ruled in Feist Publications v. Rural Telephone Service that duplication of facts is allowable. U.S. courts have acknowledged that users of ""scrapers"" or ""robots"" may be held liable for committing trespass to chattels,[8][9] which involves a computer system itself being considered personal property upon which the user of a scraper is trespassing. The best known of these cases, eBay v. Bidder's Edge, resulted in an injunction ordering Bidder's Edge to stop accessing, collecting, and indexing auctions from the eBay web site. This case involved automatic placing of bids, known as auction sniping. However, in order to succeed on a claim of trespass to chattels, the plaintiff must demonstrate that the defendant intentionally and without authorization interfered with the plaintiff's possessory interest in the computer system and that the defendant's unauthorized use caused damage to the plaintiff. Not all cases of web spidering brought before the courts have been considered trespass to chattels.[10] One of the first major tests of screen scraping involved American Airlines (AA), and a firm called FareChase.[11] AA successfully obtained an injunction from a Texas trial court, stopping FareChase from selling software that enables users to compare online fares if the software also searches AA's website. The airline argued that FareChase's websearch software trespassed on AA's servers when it collected the publicly available data. FareChase filed an appeal in March 2003. By June, FareChase and AA agreed to settle and the appeal was dropped.[12] Southwest Airlines has also challenged screen-scraping practices, and has involved both FareChase and another firm, Outtask, in a legal claim. Southwest Airlines charged that the screen-scraping is Illegal since it is an example of ""Computer Fraud and Abuse"" and has led to ""Damage and Loss"" and ""Unauthorized Access"" of Southwest's site. It also constitutes ""Interference with Business Relations"", ""Trespass"", and ""Harmful Access by Computer"". They also claimed that screen-scraping constitutes what is legally known as ""Misappropriation and Unjust Enrichment"", as well as being a breach of the web site's user agreement. Outtask denied all these claims, claiming that the prevailing law, in this case, should be US Copyright law and that under copyright, the pieces of information being scraped would not be subject to copyright protection. Although the cases were never resolved in the Supreme Court of the United States, FareChase was eventually shuttered by parent company Yahoo!, and Outtask was purchased by travel expense company Concur.[13]
In 2012, a startup called 3Taps scraped classified housing ads from Craigslist. Craigslist sent 3Taps a cease-and-desist letter and blocked their IP addresses and later sued, in Craigslist v. 3Taps. The court held that the cease-and-desist letter and IP blocking was sufficient for Craigslist to properly claim that 3Taps had violated the Computer Fraud and Abuse Act (CFAA). Although these are early scraping decisions, and the theories of liability are not uniform, it is difficult to ignore a pattern emerging that the courts are prepared to protect proprietary content on commercial sites from uses which are undesirable to the owners of such sites. However, the degree of protection for such content is not settled and will depend on the type of access made by the scraper, the amount of information accessed and copied, the degree to which the access adversely affects the site owner's system and the types and manner of prohibitions on such conduct.[14] While the law in this area becomes more settled, entities contemplating using scraping programs to access a public web site should also consider whether such action is authorized by reviewing the terms of use and other terms or notices posted on or made available through the site. In Cvent Inc. v. Eventbrite Inc. (2010), the United States district court for the eastern district of Virginia, ruled that the terms of use should be brought to the users' attention in order for a browsewrap contract or license to be enforceable.[15] In a 2014 case, filed in the United States District Court for the Eastern District of Pennsylvania,[16] e-commerce site QVC objected to the Pinterest-like shopping aggregator Resultly's 'scraping of QVC's site for real-time pricing data. QVC alleges that Resultly ""excessively crawled"" QVC's retail site (allegedly sending 200-300 search requests to QVC's website per minute, sometimes to up to 36,000 requests per minute) which caused QVC's site to crash for two days, resulting in lost sales for QVC.[17] QVC's complaint alleges that the defendant disguised its web crawler to mask its source IP address and thus prevented QVC from quickly repairing the problem. This is a particularly interesting scraping case because QVC is seeking damages for the unavailability of their website, which QVC claims was caused by Resultly. In the plaintiff's web site during the period of this trial, the terms of use link are displayed among all the links of the site, at the bottom of the page as most sites on the internet. This ruling contradicts the Irish ruling described below. The court also rejected the plaintiff's argument that the browse-wrap restrictions were enforceable in view of Virginia's adoption of the Uniform Computer Information Transactions Act (UCITA)—a uniform law that many believed was in favor on common browse-wrap contracting practices.[18] In Facebook, Inc. v. Power Ventures, Inc., a district court ruled in 2012 that Power Ventures could not scrape Facebook pages on behalf of a Facebook user. The case is on appeal, and the Electronic Frontier Foundation filed a brief in 2015 asking that it be overturned.[19][20] In Associated Press v. Meltwater U.S. Holdings, Inc., a court in the US held Meltwater liable for scraping and republishing news information from the Associated Press, but a court in the United Kingdom held in favor of Meltwater. The Ninth Circuit ruled in 2019 that web scraping did not violate the CFAA in hiQ Labs v. LinkedIn. The case was appealed to the United States Supreme Court, which returned the case to the Ninth Circuit to reconsider the case in light of the 2021 Supreme Court decision in Van Buren v. United States which narrowed the applicability of the CFAA.[21] On this review, the Ninth Circuit upheld their prior decision.[22] Internet Archive collects and distributes a significant number of publicly available web pages without being considered to be in violation of copyright laws.[citation needed] In February 2006, the Danish Maritime and Commercial Court (Copenhagen) ruled that systematic crawling, indexing, and deep linking by portal site ofir.dk of real estate site Home.dk does not conflict with Danish law or the database directive of the European Union.[23] In a February 2010 case complicated by matters of jurisdiction, Ireland's High Court delivered a verdict that illustrates the inchoate state of developing case law. In the case of Ryanair Ltd v Billigfluege.de GmbH, Ireland's High Court ruled Ryanair's ""click-wrap"" agreement to be legally binding. In contrast to the findings of the United States District Court Eastern District of Virginia and those of the Danish Maritime and Commercial Court, Justice Michael Hanna ruled that the hyperlink to Ryanair's terms and conditions was plainly visible, and that placing the onus on the user to agree to terms and conditions in order to gain access to online services is sufficient to comprise a contractual relationship.[24] The decision is under appeal in Ireland's Supreme Court.[25] On April 30, 2020, the French Data Protection Authority (CNIL) released new guidelines on web scraping.[26] The CNIL guidelines made it clear that publicly available data is still personal data and cannot be repurposed without the knowledge of the person to whom that data belongs.[27] In Australia, the Spam Act 2003 outlaws some forms of web harvesting, although this only applies to email addresses.[28][29] Leaving a few cases dealing with IPR infringement, Indian courts have not expressly ruled on the legality of web scraping. However, since all common forms of electronic contracts are enforceable in India, violating the terms of use prohibiting data scraping will be a violation of the contract law. It will also violate the Information Technology Act, 2000, which penalizes unauthorized access to a computer resource or extracting data from a computer resource. The administrator of a website can use various measures to stop or slow a bot. Some techniques include:"
https://en.wikipedia.org/wiki/Main_Page,"January 14: Ratification Day in the United States (1784) Nigeen Lake is a mildly eutrophic lake located in Srinagar, in Indian-administered Jammu and Kashmir. It is sometimes considered to be a part of Dal Lake and is connected to it via a narrow strait. This panoramic photograph shows the west bank of Nigeen Lake, with houseboats lining the shore. Hari Parbat, a hill overlooking Srinagar, is visible to the left of centre, and the snow-capped Pir Panjal Range can be seen in the distance. Photograph credit: KennyOMG; edited by UnpetitproleX Wikipedia is written by volunteer editors and hosted by the Wikimedia Foundation, a non-profit organization that also hosts a range of other volunteer projects: This Wikipedia is written in English. Many other Wikipedias are available; some of the largest are listed below."
