URL,Text
https://en.wikipedia.org/wiki/Parsing,"Parsing, syntax analysis, or syntactic analysis is the process of analyzing a string of symbols, either in natural language, computer languages or data structures, conforming to the rules of a formal grammar.  The term parsing comes from Latin pars (orationis), meaning part (of speech).[1] The term has slightly different meanings in different branches of linguistics and computer science. Traditional sentence parsing is often performed as a method of understanding the exact meaning of a sentence or word, sometimes with the aid of devices such as sentence diagrams. It usually emphasizes the importance of grammatical divisions such as subject and predicate. Within computational linguistics the term is used to refer to the formal analysis by a computer of a sentence or other string of words into its constituents, resulting in a parse tree showing their syntactic relation to each other, which may also contain semantic information.[citation needed] Some parsing algorithms generate a parse forest or list of parse trees from a string that is syntactically ambiguous.[2] The term is also used in psycholinguistics when describing language comprehension. In this context, parsing refers to the way that human beings analyze a sentence or phrase (in spoken language or text) ""in terms of grammatical constituents, identifying the parts of speech, syntactic relations, etc.""[1] This term is especially common when discussing which linguistic cues help speakers interpret garden-path sentences. Within computer science, the term is used in the analysis of computer languages, referring to the syntactic analysis of the input code into its component parts in order to facilitate the writing of compilers and interpreters. The term may also be used to describe a split or separation. The traditional grammatical exercise of parsing, sometimes known as clause analysis, involves breaking down a text into its component parts of speech with an explanation of the form, function, and syntactic relationship of each part.[3] This is determined in large part from study of the language's conjugations and declensions, which can be quite intricate for heavily inflected languages. To parse a phrase such as ""man bites dog"" involves noting that the singular noun ""man"" is the subject of the sentence, the verb ""bites"" is the third person singular of the present tense of the verb ""to bite"", and the singular noun ""dog"" is the object of the sentence. Techniques such as sentence diagrams are sometimes used to indicate relation between elements in the sentence. Parsing was formerly central to the teaching of grammar throughout the English-speaking world, and widely regarded as basic to the use and understanding of written language.  However, the general teaching of such techniques is no longer current.[citation needed] In some machine translation and natural language processing systems, written texts in human languages are parsed by computer programs.[4] Human sentences are not easily parsed by programs, as there is substantial ambiguity in the structure of human language, whose usage is to convey meaning (or semantics) amongst a potentially unlimited range of possibilities, but only some of which are germane to the particular case.[5] So an utterance ""Man bites dog"" versus ""Dog bites man"" is definite on one detail but in another language might appear as ""Man dog bites"" with a reliance on the larger context to distinguish between those two possibilities, if indeed that difference was of concern. It is difficult to prepare formal rules to describe informal behaviour even though it is clear that some rules are being followed.[citation needed] In order to parse natural language data, researchers must first agree on the grammar to be used. The choice of syntax is affected by both linguistic and computational concerns; for instance some parsing systems use lexical functional grammar, but in general, parsing for grammars of this type is known to be NP-complete. Head-driven phrase structure grammar is another linguistic formalism which has been popular in the parsing community, but other research efforts have focused on less complex formalisms such as the one used in the Penn Treebank. Shallow parsing aims to find only the boundaries of major constituents such as noun phrases. Another popular strategy for avoiding linguistic controversy is dependency grammar parsing. Most modern parsers are at least partly statistical; that is, they rely on a corpus of training data which has already been annotated (parsed by hand). This approach allows the system to gather information about the frequency with which various constructions occur in specific contexts. (See machine learning.) Approaches which have been used include straightforward PCFGs (probabilistic context-free grammars),[6] maximum entropy,[7] and neural nets.[8] Most of the more successful systems use lexical statistics (that is, they consider the identities of the words involved, as well as their part of speech). However such systems are vulnerable to overfitting and require some kind of smoothing to be effective.[citation needed] Parsing algorithms for natural language cannot rely on the grammar having 'nice' properties as with manually designed grammars for programming languages. As mentioned earlier some grammar formalisms are very difficult to parse computationally; in general, even if the desired structure is not context-free, some kind of context-free approximation to the grammar is used to perform a first pass. Algorithms which use context-free grammars often rely on some variant of the CYK algorithm, usually with some heuristic to prune away unlikely analyses to save time. (See chart parsing.) However some systems trade speed for accuracy using, e.g., linear-time versions of the shift-reduce algorithm. A somewhat recent development has been parse reranking in which the parser proposes some large number of analyses, and a more complex system selects the best option.[citation needed] In natural language understanding applications, semantic parsers convert the text into a representation of its meaning.[9] In psycholinguistics, parsing involves not just the assignment of words to categories (formation of ontological insights), but the evaluation of the meaning of a sentence according to the rules of syntax drawn by inferences made from each word in the sentence (known as connotation). This normally occurs as words are being heard or read. Neurolinguistics generally understands parsing to be a function of working memory, meaning that parsing is used to keep several parts of one sentence at play in the mind at one time, all readily accessible to be analyzed as needed. Because the human working memory has limitations, so does the function of sentence parsing.[10] This is evidenced by several different types of syntactically complex sentences that propose potentially issues for mental parsing of sentences. The first, and perhaps most well-known, type of sentence that challenges parsing ability is the garden-path sentence. These sentences are designed so that the most common interpretation of the sentence appears grammatically faulty, but upon further inspection, these sentences are grammatically sound. Garden-path sentences are difficult to parse because they contain a phrase or a word with more than one meaning, often their most typical meaning being a different part of speech.[11] For example, in the sentence, ""the horse raced past the barn fell"", raced is initially interpreted as a past tense verb, but in this sentence, it functions as part of an adjective phrase.[12] Since parsing is used to identify parts of speech, these sentences challenge the parsing ability of the reader. Another type of sentence that is difficult to parse is an attachment ambiguity, which includes a phrase that could potentially modify different parts of a sentence, and therefore presents a challenge in identifying syntactic relationship (i.e. ""The boy saw the lady with the telescope"", in which the ambiguous phrase with the telescope could modify the boy saw or the lady.) [11] A third type of sentence that challenges parsing ability is center embedding, in which phrases are placed in the center of other similarly formed phrases (i.e. ""The rat the cat the man hit chased ran into the trap"".) Sentences with 2 or in the most extreme cases 3 center embeddings are challenging for mental parsing, again because of ambiguity of syntactic relationship.[13] Within neurolinguistics there are multiple theories that aim to describe how parsing takes place in the brain. One such model is a more traditional generative model of sentence processing, which theorizes that within the brain there is a distinct module designed for sentence parsing, which is preceded by access to lexical recognition and retrieval, and then followed by syntactic processing that considers a single syntactic result of the parsing, only returning to revise that syntactic interpretation if a potential problem is detected.[14] The opposing, more contemporary model theorizes that within the mind, the processing of a sentence is not modular, or happening in strict sequence. Rather, it poses that several different syntactic possibilities can be considered at the same time, because lexical access, syntactic processing, and determination of meaning occur in parallel in the brain. In this way these processes are integrated.[15] Although there is still much to learn about the neurology of parsing, studies have shown evidence that several areas of the brain might play a role in parsing. These include the left anterior temporal pole, the left inferior frontal gyrus, the left superior temporal gyrus, the left superior frontal gyrus, the right posterior cingulate cortex, and the left angular gyrus. Although it has not been absolutely proven, it has been suggested that these different structures might favor either phrase-structure parsing or dependency-structure parsing, meaning different types of parsing could be processed in different ways which have yet to be understood.[16] Discourse analysis examines ways to analyze language use and semiotic events. Persuasive language may be called rhetoric. A parser is a software component that takes input data (typically text) and builds a data structure – often some kind of parse tree, abstract syntax tree or other hierarchical structure, giving a structural representation of the input while checking for correct syntax. The parsing may be preceded or followed by other steps, or these may be combined into a single step. The parser is often preceded by a separate lexical analyser, which creates tokens from the sequence of input characters; alternatively, these can be combined in scannerless parsing. Parsers may be programmed by hand or may be automatically or semi-automatically generated by a parser generator. Parsing is complementary to templating, which produces formatted output. These may be applied to different domains, but often appear together, such as the scanf/printf pair, or the input (front end parsing) and output (back end code generation) stages of a compiler. The input to a parser is typically text in some computer language, but may also be text in a natural language or less structured textual data, in which case generally only certain parts of the text are extracted, rather than a parse tree being constructed. Parsers range from very simple functions such as scanf, to complex programs such as the frontend of a C++ compiler or the HTML parser of a web browser. An important class of simple parsing is done using regular expressions, in which a group of regular expressions defines a regular language and a regular expression engine automatically generating a parser for that language, allowing pattern matching and extraction of text. In other contexts regular expressions are instead used prior to parsing, as the lexing step whose output is then used by the parser. The use of parsers varies by input. In the case of data languages, a parser is often found as the file reading facility of a program, such as reading in HTML or XML text; these examples are markup languages. In the case of programming languages, a parser is a component of a compiler or interpreter, which parses the source code of a computer programming language to create some form of internal representation; the parser is a key step in the compiler frontend. Programming languages tend to be specified in terms of a deterministic context-free grammar because fast and efficient parsers can be written for them. For compilers, the parsing itself can be done in one pass or multiple passes – see one-pass compiler and multi-pass compiler. The implied disadvantages of a one-pass compiler can largely be overcome by adding fix-ups, where provision is made for code relocation during the forward pass, and the fix-ups are applied backwards when the current program segment has been recognized as having been completed. An example where such a fix-up mechanism would be useful would be a forward GOTO statement, where the target of the GOTO is unknown until the program segment is completed. In this case, the application of the fix-up would be delayed until the target of the GOTO was recognized. Conversely, a backward GOTO does not require a fix-up, as the location will already be known. Context-free grammars are limited in the extent to which they can express all of the requirements of a language. Informally, the reason is that the memory of such a language is limited. The grammar cannot remember the presence of a construct over an arbitrarily long input; this is necessary for a language in which, for example, a name must be declared before it may be referenced. More powerful grammars that can express this constraint, however, cannot be parsed efficiently. Thus, it is a common strategy to create a relaxed parser for a context-free grammar which accepts a superset of the desired language constructs (that is, it accepts some invalid constructs); later, the unwanted constructs can be filtered out at the semantic analysis (contextual analysis) step. For example, in Python the following is syntactically valid code: The following code, however, is syntactically valid in terms of the context-free grammar, yielding a syntax tree with the same structure as the previous, but violates the semantic  rule requiring variables to be initialized before use: The following example demonstrates the common case of parsing a computer language with two levels of grammar: lexical and syntactic. The first stage is the token generation, or lexical analysis, by which the input character stream is split into meaningful symbols defined by a grammar of regular expressions. For example, a calculator program would look at an input such as ""12 * (3 + 4)^2"" and split it into the tokens 12, *, (, 3, +, 4, ), ^, 2, each of which is a meaningful symbol in the context of an arithmetic expression. The lexer would contain rules to tell it that the characters *, +, ^, ( and ) mark the start of a new token, so meaningless tokens like ""12*"" or ""(3"" will not be generated. The next stage is parsing or syntactic analysis, which is checking that the tokens form an allowable expression. This is usually done with reference to a context-free grammar which recursively defines components that can make up an expression and the order in which they must appear. However, not all rules defining programming languages can be expressed by context-free grammars alone, for example type validity and proper declaration of identifiers. These rules can be formally expressed with attribute grammars. The final phase is semantic parsing or analysis, which is working out the implications of the expression just validated and taking the appropriate action.[17] In the case of a calculator or interpreter, the action is to evaluate the expression or program; a compiler, on the other hand, would generate some kind of code. Attribute grammars can also be used to define these actions. The task of the parser is essentially to determine if and how the input can be derived from the start symbol of the grammar. This can be done in essentially two ways: LL parsers and recursive-descent parser  are examples of top-down parsers that cannot accommodate left recursive production rules. Although it has been believed that simple implementations of top-down parsing cannot accommodate direct and indirect left-recursion and may require exponential time and space complexity while parsing ambiguous context-free grammars, more sophisticated algorithms for top-down parsing have been created by Frost, Hafiz, and Callaghan[20][21] which accommodate ambiguity and left recursion in polynomial time and which generate polynomial-size representations of the potentially exponential number of parse trees. Their algorithm is able to produce both left-most and right-most derivations of an input with regard to a given context-free grammar. An important distinction with regard to parsers is whether a parser generates a leftmost derivation or a rightmost derivation (see context-free grammar). LL parsers will generate a leftmost derivation and LR parsers will generate a rightmost derivation (although usually in reverse).[18] Some graphical parsing algorithms have been designed for visual programming languages.[22][23] Parsers for visual languages are sometimes based on graph grammars.[24] Adaptive parsing algorithms have been used to construct ""self-extending"" natural language user interfaces.[25] A simple parser implementation reads the entire input file, performs an intermediate computation or translation, and then writes the entire output file,
such as in-memory multi-pass compilers. Alternative parser implementation approaches: Some of the well known parser development tools include the following: Lookahead establishes the maximum incoming tokens that a parser can use to decide which rule it should use. Lookahead is especially relevant to LL, LR, and LALR parsers, where it is often explicitly indicated by affixing the lookahead to the algorithm name in parentheses, such as LALR(1). Most programming languages, the primary target of parsers, are carefully defined in such a way that a parser with limited lookahead, typically one, can parse them, because parsers with limited lookahead are often more efficient. One important change[citation needed] to this trend came in 1990 when Terence Parr created ANTLR for his Ph.D. thesis, a parser generator for efficient LL(k) parsers, where k is any fixed value. LR parsers typically have only a few actions after seeing each token. They are shift (add this token to the stack for later reduction), reduce (pop tokens from the stack and form a syntactic construct), end, error (no known rule applies) or conflict (does not know whether to shift or reduce). Lookahead has two advantages.[clarification needed] Example: Parsing the Expression  1 + 2 * 3[dubious – discuss] Most programming languages (except for a few such as APL and Smalltalk) and algebraic formulas give higher precedence to multiplication than addition, in which case the correct interpretation of the example above is 1 + (2 * 3).
Note that Rule4 above is a semantic rule. It is possible to rewrite the grammar to incorporate this into the syntax. However, not all such rules can be translated into syntax. Initially Input = [1, +, 2, *, 3] The parse tree and resulting code from it is not correct according to language semantics. To correctly parse without lookahead, there are three solutions: The parse tree generated is correct and simply more efficient[clarify][citation needed] than non-lookahead parsers. This is the strategy followed in LALR parsers."
https://en.wikipedia.org/wiki/Contact_scraping,"In online advertising, contact scraping is the practice of obtaining access to a customer's e-mail account in order to retrieve contact information that is then used for marketing purposes. The New York Times refers to the practices of Tagged, MyLife and desktopdating.net as ""contact scraping"".[1] Several commercial packages are available that implement contact scraping for their customers, including ViralInviter, TrafficXplode, and TheTsunamiEffect.[2] Contact scraping is one of the applications of web scraping, and the example of email scraping tools include Uipath, Import.io, and Screen Scraper.  The alternative web scraping tools include UzunExt, R functions, and Python Beautiful Soup. The legal issues of contact scraping is under the legality of web scraping. Following web scraping tools can be used as alternatives for contact scraping: In the United States, there exists three most commonly legal claims related to web scraping: compilation copyright infringement, violation of the Computer Fraud and Abuse Act (CFAA), and electronic trespass to chattel claims. For example, the users of ""scraping tools"" may violate the electronic trespass to chattel claims.[6] One of the well-known cases is Intel Corp. v. Hamidi, in which the US court decided that the computer context was not included in the common law trespass claims.[7][8] However, the three legal claims have been changed doctrinally, and it is uncertain whether the claims will still exist in the future.[6][9] For instance, the applicability of the CFAA has been narrowed due to the technical similarities between web scraping and web browsing.[10] In the case of EF Cultural Travel BV v. Zefer Corp., the court declined to apply CFAA since EF failed to meet the standard for ""damage"".[11] By the Article 14 of the EU's General Data Protection Regulation (GDPR), data controllers are obligated to inform individuals before processing personal data.[12] In the case of Bisnode vs. Polish Supervisory Authority, Bisnode obtained personal data from the government public register of business activity, and the data were used for business purpose. However, Bisnode only obtained email addresses for some of the people, so the mail notifications were only sent to those individuals. Instead of directly informing other people, Bisnode simply posted a notice on its website, and thus it failed to comply with the GDPR's Article 14 obligations.[13][14] In Australia, address‑harvesting software and harvested‑address lists must not be supplied, acquired, or used under the Spam Act 2003. The Spam Act also requires all marketing emails to be sent with the consent of the recipients, and all emails must include an opt-out facility.[15] The company behind the GraysOnline shopping websites was fined after sending emails that breached the Spam Act. GraysOnline sent messages without an option for recipients to opt-out of receiving further emails, and it sent emails to people who had previously withdrawn their consent from receiving Grays' emails.[16][17] Under the Cybersecurity Law of the People's Republic of China, web crawling of publicly available information is regarded as legal, but it would be illegal to obtain nonpublic, sensitive personal information without consent.[18] On November 24, 2017, three people were convicted of the crime of illegally scraping information system data stored on the server of Beijing ByteDance Networking Technology Co., Ltd.[19]"
https://en.wikipedia.org/wiki/Web_indexing,"Web indexing, or Internet indexing, comprises methods for indexing the contents of a website or of the Internet as a whole. Individual websites or intranets may use a back-of-the-book index, while search engines usually use keywords and metadata to provide a more useful vocabulary for Internet or onsite searching. With the increase in the number of periodicals that have articles online, web indexing is also becoming important for periodical websites.[1] Back-of-the-book-style web indexes may be called ""web site A-Z indexes"".[2] The implication with ""A-Z"" is that there is an alphabetical browse view or interface. This interface differs from that of a browse through layers of hierarchical categories (also known as a taxonomy) which are not necessarily alphabetical, but are also found on some web sites. Although an A-Z index could be used to index multiple sites, rather than the multiple pages of a single site, this is unusual. Metadata web indexing involves assigning keywords, description or phrases to web pages or web sites within a metadata tag (or ""meta-tag"") field, so that the web page or web site can be retrieved with a list. This method is commonly used by search engine indexing.[3] 4. What is Website Indexing? This Internet-related article is a stub. You can help Wikipedia by expanding it."
